{
  "$schema": "../schemas/source-contract-cases.schema.json",
  "id": "perps-scm-openapi-cases",
  "sourceId": "perps_scm_openapi",
  "kind": "source-contract-cases",
  "description": "Source-qualified representative contract validation; imported completeness is not review approval.",
  "input": {
    "cases": [
      {
        "name": "error-positive",
        "caseId": "perps_scm_openapi:error-positive",
        "identity": {
          "sourceId": "perps_scm_openapi",
          "pointer": "#/components/schemas/Error"
        },
        "operation": {
          "sourceId": "perps_scm_openapi",
          "pointer": "#/paths/~1margin~1funding_payments/get"
        },
        "value": {
          "code": "forbidden",
          "message": "Forbidden"
        },
        "valid": true
      },
      {
        "name": "error-negative",
        "caseId": "perps_scm_openapi:error-negative",
        "identity": {
          "sourceId": "perps_scm_openapi",
          "pointer": "#/components/schemas/Error"
        },
        "operation": {
          "sourceId": "perps_scm_openapi",
          "pointer": "#/paths/~1margin~1funding_payments/get"
        },
        "value": {
          "code": "forbidden"
        },
        "valid": false
      },
      {
        "name": "composed-payment-positive",
        "caseId": "perps_scm_openapi:composed-payment-positive",
        "identity": {
          "sourceId": "perps_scm_openapi",
          "pointer": "#/components/schemas/MemberFundingPayment"
        },
        "operation": {
          "sourceId": "perps_scm_openapi",
          "pointer": "#/paths/~1margin~1funding_payments/get"
        },
        "value": {
          "id": "payment-1",
          "market_ticker": "BTC",
          "subtrader_id": "sub-1",
          "funding_time": "2026-10-12T00:00:00Z",
          "position_quantity_fp": "1.25",
          "notional_value_centicents": 100,
          "funding_amount_centicents": -5,
          "settlement_execution_time": "2026-10-12T01:00:00Z"
        },
        "valid": true
      },
      {
        "name": "composed-payment-negative",
        "caseId": "perps_scm_openapi:composed-payment-negative",
        "identity": {
          "sourceId": "perps_scm_openapi",
          "pointer": "#/components/schemas/MemberFundingPayment"
        },
        "operation": {
          "sourceId": "perps_scm_openapi",
          "pointer": "#/paths/~1margin~1funding_payments/get"
        },
        "value": {
          "id": "payment-1",
          "market_ticker": "BTC",
          "subtrader_id": "sub-1",
          "funding_time": "2026-10-12T00:00:00Z",
          "position_quantity_fp": "1.25",
          "notional_value_centicents": 100,
          "funding_amount_centicents": -5,
          "settlement_execution_time": "yesterday"
        },
        "valid": false
      },
      {
        "name": "payment-pagination-positive",
        "caseId": "perps_scm_openapi:payment-pagination-positive",
        "identity": {
          "sourceId": "perps_scm_openapi",
          "pointer": "#/components/schemas/GetMemberFundingPaymentsResponse"
        },
        "operation": {
          "sourceId": "perps_scm_openapi",
          "pointer": "#/paths/~1margin~1funding_payments/get"
        },
        "value": {
          "payments": [
            {
              "id": "payment-1",
              "market_ticker": "BTC",
              "subtrader_id": "sub-1",
              "funding_time": "2026-10-12T00:00:00Z",
              "position_quantity_fp": "1.25",
              "notional_value_centicents": 100,
              "funding_amount_centicents": -5,
              "settlement_execution_time": "2026-10-12T01:00:00Z"
            }
          ],
          "cursor": "next"
        },
        "valid": true
      },
      {
        "name": "payment-pagination-negative",
        "caseId": "perps_scm_openapi:payment-pagination-negative",
        "identity": {
          "sourceId": "perps_scm_openapi",
          "pointer": "#/components/schemas/GetMemberFundingPaymentsResponse"
        },
        "operation": {
          "sourceId": "perps_scm_openapi",
          "pointer": "#/paths/~1margin~1funding_payments/get"
        },
        "value": {
          "payments": [
            {
              "id": "incomplete"
            }
          ],
          "cursor": "next"
        },
        "valid": false
      },
      {
        "name": "payment-terminal-positive",
        "caseId": "perps_scm_openapi:payment-terminal-positive",
        "identity": {
          "sourceId": "perps_scm_openapi",
          "pointer": "#/components/schemas/GetMemberFundingPaymentsResponse"
        },
        "operation": {
          "sourceId": "perps_scm_openapi",
          "pointer": "#/paths/~1margin~1funding_payments/get"
        },
        "value": {
          "payments": []
        },
        "valid": true
      },
      {
        "name": "payment-terminal-negative",
        "caseId": "perps_scm_openapi:payment-terminal-negative",
        "identity": {
          "sourceId": "perps_scm_openapi",
          "pointer": "#/components/schemas/GetMemberFundingPaymentsResponse"
        },
        "operation": {
          "sourceId": "perps_scm_openapi",
          "pointer": "#/paths/~1margin~1funding_payments/get"
        },
        "value": {
          "payments": [],
          "cursor": 5
        },
        "valid": false
      },
      {
        "name": "pagination-limit-positive",
        "caseId": "perps_scm_openapi:pagination-limit-positive",
        "identity": {
          "sourceId": "perps_scm_openapi",
          "pointer": "#/paths/~1margin~1funding_payments/get/parameters/2/schema"
        },
        "operation": {
          "sourceId": "perps_scm_openapi",
          "pointer": "#/paths/~1margin~1funding_payments/get"
        },
        "value": 10000,
        "valid": true
      },
      {
        "name": "pagination-limit-negative",
        "caseId": "perps_scm_openapi:pagination-limit-negative",
        "identity": {
          "sourceId": "perps_scm_openapi",
          "pointer": "#/paths/~1margin~1funding_payments/get/parameters/2/schema"
        },
        "operation": {
          "sourceId": "perps_scm_openapi",
          "pointer": "#/paths/~1margin~1funding_payments/get"
        },
        "value": 10001,
        "valid": false
      }
    ]
  },
  "expected": {
    "allCasesMatch": true
  }
}
